{
  "$schema": "https://erdesigns.eu/schema/dtc-catalog.json",
  "version": 1,
  "name": "Detroit Diesel DTC starter (J1939 SPN-FMI + GHG17)",
  "default_source": "Detroit DDDL community SPN/FMI DTCs",
  "dtcs": [
    {
      "code": "SPN0091-FMI4",
      "severity": "warning",
      "description": "Detroit — Accelerator pedal position sensor 1 voltage low",
      "verified": false
    },
    {
      "code": "SPN0102-FMI3",
      "severity": "warning",
      "description": "Detroit — Engine intake manifold pressure circuit voltage high",
      "verified": false
    },
    {
      "code": "SPN0157-FMI4",
      "severity": "warning",
      "description": "Detroit — Fuel rail pressure sensor circuit voltage low",
      "verified": false
    },
    {
      "code": "SPN3216-FMI16",
      "severity": "warning",
      "description": "Detroit — Aftertreatment 1 SCR catalyst NOx inlet high",
      "verified": false
    },
    {
      "code": "SPN3251",
      "severity": "warning",
      "description": "DPF Differential Pressure (Detroit DD13/DD15)",
      "possible_causes": [
        "Sensor / actuator failure",
        "Wiring fault",
        "Module driver failure"
      ],
      "verified": false,
      "symptoms": [
        "MIL on",
        "Possible drivability impact"
      ],
      "repair_guidance": [
        "1) Read freeze-frame data and verify the fault is current.",
        "2) Inspect the affected sensor / actuator wiring for chafing, corrosion, or loose connectors.",
        "3) Measure circuit resistance + supply voltage with a multimeter.",
        "4) Compare live data against expected values per OEM service data.",
        "5) Replace the defective component if all wiring tests pass."
      ],
      "monitor_type": "continuous",
      "freeze_frame_relevant": true,
      "related_dids": [],
      "related_routines": [
        "ecm_dpf_regen_force"
      ],
      "oem_bulletin": ""
    },
    {
      "code": "SPN3251-FMI0",
      "severity": "warning",
      "description": "Detroit — DPF differential pressure above normal range",
      "verified": false
    },
    {
      "code": "SPN3361-FMI4",
      "severity": "warning",
      "description": "Detroit — DEF dosing valve circuit voltage low",
      "verified": false
    },
    {
      "code": "SPN3818-FMI31",
      "severity": "warning",
      "description": "Detroit — DEF quality unacceptable (water dilution)",
      "verified": false
    },
    {
      "code": "SPN5246",
      "severity": "critical",
      "description": "SCR Inducement (Detroit Diesel)",
      "possible_causes": [
        "Sensor / actuator failure",
        "Wiring fault",
        "Module driver failure"
      ],
      "verified": false,
      "symptoms": [
        "MIL on",
        "Possible drivability impact"
      ],
      "repair_guidance": [
        "1) Read freeze-frame data and verify the fault is current.",
        "2) Inspect the affected sensor / actuator wiring for chafing, corrosion, or loose connectors.",
        "3) Measure circuit resistance + supply voltage with a multimeter.",
        "4) Compare live data against expected values per OEM service data.",
        "5) Replace the defective component if all wiring tests pass."
      ],
      "monitor_type": "continuous",
      "freeze_frame_relevant": true,
      "related_dids": [],
      "related_routines": [],
      "oem_bulletin": ""
    },
    {
      "code": "SPN5571-FMI16",
      "severity": "critical",
      "description": "Detroit — DEF tank level inducement (warning derate)",
      "verified": false
    }
  ]
}
