{
  "$schema": "https://erdesigns.eu/schema/dtc-catalog.json",
  "version": 1,
  "name": "Stellantis DTC starter (DiagBox / wiTech common P1 / B / U codes)",
  "default_source": "Stellantis wiTech / Mopar / Multiecuscan community DTCs",
  "dtcs": [
    {
      "code": "B1003",
      "severity": "warning",
      "description": "PSA BSI — Battery Voltage Out Of Range",
      "verified": false
    },
    {
      "code": "P0299",
      "severity": "warning",
      "description": "Supercharger Underboost (Hemi 6.2L SC)",
      "possible_causes": [
        "Sensor / actuator failure",
        "Wiring fault",
        "Module driver failure"
      ],
      "verified": false,
      "symptoms": [
        "MIL on",
        "Possible drivability impact"
      ],
      "repair_guidance": [
        "1) Confirm boost target vs actual via live data.",
        "2) Smoke-test the intake / charge-air system for leaks.",
        "3) Inspect wastegate solenoid and actuator rod travel.",
        "4) Check for cracked CAC, intercooler, or hose clamps.",
        "5) Replace failed solenoid / actuator if signal correct."
      ],
      "monitor_type": "continuous",
      "freeze_frame_relevant": true,
      "related_dids": [
        "ecm_supercharger_rpm"
      ],
      "related_routines": [],
      "oem_bulletin": ""
    },
    {
      "code": "P0606",
      "severity": "warning",
      "description": "PCM Processor Internal Performance Failure (Stellantis)",
      "verified": false
    },
    {
      "code": "P0731",
      "severity": "warning",
      "description": "Gear 1 Incorrect Ratio (ZF 8HP / wiTech)",
      "possible_causes": [
        "Sensor / actuator failure",
        "Wiring fault",
        "Module driver failure"
      ],
      "verified": false,
      "symptoms": [
        "MIL on",
        "Possible drivability impact"
      ],
      "repair_guidance": [
        "1) Check trans fluid level and condition.",
        "2) Read TCM adaptive values; reset and run a quick-learn cycle.",
        "3) Run actuator test on each shift solenoid.",
        "4) Check valve body for stuck spool valves.",
        "5) Replace TCM or rebuild trans if internal damage indicated."
      ],
      "monitor_type": "continuous",
      "freeze_frame_relevant": true,
      "related_dids": [],
      "related_routines": [],
      "oem_bulletin": ""
    },
    {
      "code": "P0884",
      "severity": "warning",
      "description": "TCM Power Input Signal Intermittent",
      "possible_causes": [
        "Sensor / actuator failure",
        "Wiring fault",
        "Module driver failure"
      ],
      "verified": false,
      "symptoms": [
        "MIL on",
        "Possible drivability impact"
      ],
      "repair_guidance": [
        "1) Read freeze-frame data and verify the fault is current.",
        "2) Inspect the affected sensor / actuator wiring for chafing, corrosion, or loose connectors.",
        "3) Measure circuit resistance + supply voltage with a multimeter.",
        "4) Compare live data against expected values per OEM service data.",
        "5) Replace the defective component if all wiring tests pass."
      ],
      "monitor_type": "continuous",
      "freeze_frame_relevant": true,
      "related_dids": [],
      "related_routines": [],
      "oem_bulletin": ""
    },
    {
      "code": "P0A78",
      "severity": "critical",
      "description": "Drive Motor 'A' Inverter Performance (Wrangler 4xe / Pacifica Hybrid)",
      "possible_causes": [
        "Sensor / actuator failure",
        "Wiring fault",
        "Module driver failure"
      ],
      "verified": false,
      "symptoms": [
        "MIL on",
        "Possible drivability impact"
      ],
      "repair_guidance": [
        "1) Read freeze-frame data and verify the fault is current.",
        "2) Inspect the affected sensor / actuator wiring for chafing, corrosion, or loose connectors.",
        "3) Measure circuit resistance + supply voltage with a multimeter.",
        "4) Compare live data against expected values per OEM service data.",
        "5) Replace the defective component if all wiring tests pass."
      ],
      "monitor_type": "continuous",
      "freeze_frame_relevant": true,
      "related_dids": [],
      "related_routines": [],
      "oem_bulletin": ""
    },
    {
      "code": "P0A93",
      "severity": "critical",
      "description": "Inverter A Cooling System Performance",
      "possible_causes": [
        "Sensor / actuator failure",
        "Wiring fault",
        "Module driver failure"
      ],
      "verified": false,
      "symptoms": [
        "MIL on",
        "Possible drivability impact"
      ],
      "repair_guidance": [
        "1) Read freeze-frame data and verify the fault is current.",
        "2) Inspect the affected sensor / actuator wiring for chafing, corrosion, or loose connectors.",
        "3) Measure circuit resistance + supply voltage with a multimeter.",
        "4) Compare live data against expected values per OEM service data.",
        "5) Replace the defective component if all wiring tests pass."
      ],
      "monitor_type": "continuous",
      "freeze_frame_relevant": true,
      "related_dids": [],
      "related_routines": [],
      "oem_bulletin": ""
    },
    {
      "code": "P1004",
      "severity": "warning",
      "description": "Short Runner Valve Control — Performance (FCA)",
      "verified": false
    },
    {
      "code": "P1294",
      "severity": "warning",
      "description": "Target Idle Not Reached (FCA)",
      "verified": false
    },
    {
      "code": "P1456",
      "severity": "warning",
      "description": "Evaporative Emission System Leak Detected — Fuel Tank (FCA)",
      "verified": false
    },
    {
      "code": "P2173",
      "severity": "warning",
      "description": "High Air Flow / Vacuum Leak Detected — Slow Accumulation (FCA)",
      "verified": false
    },
    {
      "code": "P3400",
      "severity": "info",
      "description": "Cylinder Deactivation System Bank 1 (Hemi MDS)",
      "possible_causes": [
        "Sensor / actuator failure",
        "Wiring fault",
        "Module driver failure"
      ],
      "verified": false,
      "symptoms": [
        "MIL on",
        "Possible drivability impact"
      ],
      "repair_guidance": [
        "1) Read freeze-frame data and verify the fault is current.",
        "2) Inspect the affected sensor / actuator wiring for chafing, corrosion, or loose connectors.",
        "3) Measure circuit resistance + supply voltage with a multimeter.",
        "4) Compare live data against expected values per OEM service data.",
        "5) Replace the defective component if all wiring tests pass."
      ],
      "monitor_type": "continuous",
      "freeze_frame_relevant": true,
      "related_dids": [],
      "related_routines": [],
      "oem_bulletin": ""
    },
    {
      "code": "P3441",
      "severity": "warning",
      "description": "Cylinder 1 Deactivation/Intake Valve Solenoid Performance",
      "possible_causes": [
        "Sensor / actuator failure",
        "Wiring fault",
        "Module driver failure"
      ],
      "verified": false,
      "symptoms": [
        "MIL on",
        "Possible drivability impact"
      ],
      "repair_guidance": [
        "1) Read freeze-frame data and verify the fault is current.",
        "2) Inspect the affected sensor / actuator wiring for chafing, corrosion, or loose connectors.",
        "3) Measure circuit resistance + supply voltage with a multimeter.",
        "4) Compare live data against expected values per OEM service data.",
        "5) Replace the defective component if all wiring tests pass."
      ],
      "monitor_type": "continuous",
      "freeze_frame_relevant": true,
      "related_dids": [],
      "related_routines": [],
      "oem_bulletin": ""
    },
    {
      "code": "U0428",
      "severity": "info",
      "description": "Lost Communication With Active Aero Module (Charger Daytona)",
      "possible_causes": [
        "Sensor / actuator failure",
        "Wiring fault",
        "Module driver failure"
      ],
      "verified": false,
      "symptoms": [
        "MIL on",
        "Possible drivability impact"
      ],
      "repair_guidance": [
        "1) Read freeze-frame data and verify the fault is current.",
        "2) Inspect the affected sensor / actuator wiring for chafing, corrosion, or loose connectors.",
        "3) Measure circuit resistance + supply voltage with a multimeter.",
        "4) Compare live data against expected values per OEM service data.",
        "5) Replace the defective component if all wiring tests pass."
      ],
      "monitor_type": "continuous",
      "freeze_frame_relevant": true,
      "related_dids": [],
      "related_routines": [],
      "oem_bulletin": ""
    },
    {
      "code": "U1100",
      "severity": "critical",
      "description": "PSA — Lost Communication With BSI",
      "verified": false
    }
  ]
}
