{
  "$schema": "https://erdesigns.eu/schema/dtc-catalog.json",
  "version": 1,
  "name": "MAN Truck & Bus DTC starter (J1939 SPN-FMI + MAN-cats)",
  "default_source": "MAN-cats II community SPN/FMI DTCs",
  "dtcs": [
    {
      "code": "SPN0094-FMI4",
      "severity": "warning",
      "description": "MAN — Fuel delivery pressure circuit voltage low (D26 / D08)",
      "verified": false
    },
    {
      "code": "SPN0157-FMI3",
      "severity": "warning",
      "description": "MAN — High-pressure fuel rail sensor voltage high",
      "verified": false
    },
    {
      "code": "SPN0639-FMI19",
      "severity": "critical",
      "description": "MAN — J1939 backbone communication abnormal update rate",
      "verified": false
    },
    {
      "code": "SPN1761",
      "severity": "warning",
      "description": "DEF Level Low (MAN)",
      "possible_causes": [
        "Sensor / actuator failure",
        "Wiring fault",
        "Module driver failure"
      ],
      "verified": false,
      "symptoms": [
        "MIL on",
        "Possible drivability impact"
      ],
      "repair_guidance": [
        "1) Read freeze-frame data and verify the fault is current.",
        "2) Inspect the affected sensor / actuator wiring for chafing, corrosion, or loose connectors.",
        "3) Measure circuit resistance + supply voltage with a multimeter.",
        "4) Compare live data against expected values per OEM service data.",
        "5) Replace the defective component if all wiring tests pass."
      ],
      "monitor_type": "continuous",
      "freeze_frame_relevant": true,
      "related_dids": [],
      "related_routines": [],
      "oem_bulletin": ""
    },
    {
      "code": "SPN1761-FMI18",
      "severity": "warning",
      "description": "MAN — DEF tank level low (refill warning)",
      "verified": false
    },
    {
      "code": "SPN3251",
      "severity": "warning",
      "description": "DPF dP Out of Range (D08/D20/D26/D38)",
      "possible_causes": [
        "Sensor / actuator failure",
        "Wiring fault",
        "Module driver failure"
      ],
      "verified": false,
      "symptoms": [
        "MIL on",
        "Possible drivability impact"
      ],
      "repair_guidance": [
        "1) Read freeze-frame data and verify the fault is current.",
        "2) Inspect the affected sensor / actuator wiring for chafing, corrosion, or loose connectors.",
        "3) Measure circuit resistance + supply voltage with a multimeter.",
        "4) Compare live data against expected values per OEM service data.",
        "5) Replace the defective component if all wiring tests pass."
      ],
      "monitor_type": "continuous",
      "freeze_frame_relevant": true,
      "related_dids": [],
      "related_routines": [],
      "oem_bulletin": ""
    },
    {
      "code": "SPN3251-FMI16",
      "severity": "warning",
      "description": "MAN — DPF differential pressure high (regen needed)",
      "verified": false
    },
    {
      "code": "SPN3719-FMI16",
      "severity": "critical",
      "description": "MAN — DPF soot load most severe (parked regen mandatory)",
      "verified": false
    },
    {
      "code": "SPN5246",
      "severity": "critical",
      "description": "SCR Inducement (MAN)",
      "possible_causes": [
        "Sensor / actuator failure",
        "Wiring fault",
        "Module driver failure"
      ],
      "verified": false,
      "symptoms": [
        "MIL on",
        "Possible drivability impact"
      ],
      "repair_guidance": [
        "1) Read freeze-frame data and verify the fault is current.",
        "2) Inspect the affected sensor / actuator wiring for chafing, corrosion, or loose connectors.",
        "3) Measure circuit resistance + supply voltage with a multimeter.",
        "4) Compare live data against expected values per OEM service data.",
        "5) Replace the defective component if all wiring tests pass."
      ],
      "monitor_type": "continuous",
      "freeze_frame_relevant": true,
      "related_dids": [],
      "related_routines": [],
      "oem_bulletin": ""
    },
    {
      "code": "SPN5571-FMI16",
      "severity": "critical",
      "description": "MAN — DEF inducement engaged (engine power derate)",
      "verified": false
    }
  ]
}
