{
  "$schema": "https://erdesigns.eu/schema/dtc-catalog.json",
  "version": 1,
  "name": "Volvo Trucks / Mack / Renault Trucks DTC starter",
  "default_source": "Volvo Trucks Tech Tool community SPN/FMI DTCs",
  "dtcs": [
    {
      "code": "MID128-PSID235-FMI3",
      "severity": "warning",
      "description": "Volvo / Mack — EMS / EMC engine speed sensor 1 input voltage high",
      "verified": false
    },
    {
      "code": "MID128-PSID236-FMI4",
      "severity": "warning",
      "description": "Volvo / Mack — Engine speed sensor 2 input voltage low",
      "verified": false
    },
    {
      "code": "SPN0190-FMI16",
      "severity": "warning",
      "description": "Volvo Trucks — Engine speed above normal range",
      "verified": false
    },
    {
      "code": "SPN1761",
      "severity": "warning",
      "description": "DEF Tank Level Low (I-Save D13TC)",
      "possible_causes": [
        "Sensor / actuator failure",
        "Wiring fault",
        "Module driver failure"
      ],
      "verified": false,
      "symptoms": [
        "MIL on",
        "Possible drivability impact"
      ],
      "repair_guidance": [
        "1) Read freeze-frame data and verify the fault is current.",
        "2) Inspect the affected sensor / actuator wiring for chafing, corrosion, or loose connectors.",
        "3) Measure circuit resistance + supply voltage with a multimeter.",
        "4) Compare live data against expected values per OEM service data.",
        "5) Replace the defective component if all wiring tests pass."
      ],
      "monitor_type": "continuous",
      "freeze_frame_relevant": true,
      "related_dids": [],
      "related_routines": [],
      "oem_bulletin": ""
    },
    {
      "code": "SPN3251",
      "severity": "warning",
      "description": "DPF dP (Volvo D11/D13/D16)",
      "possible_causes": [
        "Sensor / actuator failure",
        "Wiring fault",
        "Module driver failure"
      ],
      "verified": false,
      "symptoms": [
        "MIL on",
        "Possible drivability impact"
      ],
      "repair_guidance": [
        "1) Read freeze-frame data and verify the fault is current.",
        "2) Inspect the affected sensor / actuator wiring for chafing, corrosion, or loose connectors.",
        "3) Measure circuit resistance + supply voltage with a multimeter.",
        "4) Compare live data against expected values per OEM service data.",
        "5) Replace the defective component if all wiring tests pass."
      ],
      "monitor_type": "continuous",
      "freeze_frame_relevant": true,
      "related_dids": [],
      "related_routines": [],
      "oem_bulletin": ""
    },
    {
      "code": "SPN3251-FMI0",
      "severity": "warning",
      "description": "Volvo Trucks — DPF differential pressure above normal",
      "verified": false
    },
    {
      "code": "SPN3361-FMI3",
      "severity": "warning",
      "description": "Volvo Trucks — DEF dosing valve circuit voltage high",
      "verified": false
    },
    {
      "code": "SPN3719-FMI16",
      "severity": "critical",
      "description": "Volvo Trucks — Particulate trap soot load most severe",
      "verified": false
    },
    {
      "code": "SPN5246",
      "severity": "critical",
      "description": "SCR Inducement (Volvo Trucks)",
      "possible_causes": [
        "Sensor / actuator failure",
        "Wiring fault",
        "Module driver failure"
      ],
      "verified": false,
      "symptoms": [
        "MIL on",
        "Possible drivability impact"
      ],
      "repair_guidance": [
        "1) Read freeze-frame data and verify the fault is current.",
        "2) Inspect the affected sensor / actuator wiring for chafing, corrosion, or loose connectors.",
        "3) Measure circuit resistance + supply voltage with a multimeter.",
        "4) Compare live data against expected values per OEM service data.",
        "5) Replace the defective component if all wiring tests pass."
      ],
      "monitor_type": "continuous",
      "freeze_frame_relevant": true,
      "related_dids": [],
      "related_routines": [],
      "oem_bulletin": ""
    },
    {
      "code": "SPN5571-FMI17",
      "severity": "critical",
      "description": "Volvo Trucks — DEF inducement (forced derate)",
      "verified": false
    }
  ]
}
