{
  "$schema": "https://erdesigns.eu/schema/dtc-catalog.json",
  "version": 1,
  "name": "Tesla DTC starter",
  "default_source": "Tesla Service Mode / TeslaScan community DTCs",
  "dtcs": [
    {
      "code": "APP_w304",
      "severity": "info",
      "description": "Autopilot Camera Cleaning Required",
      "possible_causes": [
        "Sensor / actuator failure",
        "Wiring fault",
        "Module driver failure"
      ],
      "verified": false,
      "symptoms": [
        "MIL on",
        "Possible drivability impact"
      ],
      "repair_guidance": [
        "1) Read freeze-frame data and verify the fault is current.",
        "2) Inspect the affected sensor / actuator wiring for chafing, corrosion, or loose connectors.",
        "3) Measure circuit resistance + supply voltage with a multimeter.",
        "4) Compare live data against expected values per OEM service data.",
        "5) Replace the defective component if all wiring tests pass."
      ],
      "monitor_type": "continuous",
      "freeze_frame_relevant": true,
      "related_dids": [],
      "related_routines": [],
      "oem_bulletin": ""
    },
    {
      "code": "BMS_a035",
      "severity": "critical",
      "description": "HV Battery Pack Imbalance (Tesla BMS)",
      "possible_causes": [
        "Sensor / actuator failure",
        "Wiring fault",
        "Module driver failure"
      ],
      "verified": false,
      "symptoms": [
        "MIL on",
        "Possible drivability impact"
      ],
      "repair_guidance": [
        "1) Check pack SOH, cell delta, and individual cell voltages.",
        "2) Run cell-balance routine.",
        "3) Inspect HV connectors for corrosion / arcing damage.",
        "4) Test pack isolation — replace damaged module if isolation low."
      ],
      "monitor_type": "continuous",
      "freeze_frame_relevant": true,
      "related_dids": [],
      "related_routines": [
        "hv_cell_balance"
      ],
      "oem_bulletin": ""
    },
    {
      "code": "BMS_a066",
      "severity": "critical",
      "description": "Tesla BMS_a066 — HV battery contactor weld detected",
      "verified": false
    },
    {
      "code": "BMS_w168",
      "severity": "warning",
      "description": "Tesla BMS_w168 — HV battery temperature high (degraded charging)",
      "verified": false
    },
    {
      "code": "CC_a005",
      "severity": "warning",
      "description": "Charge Connector Latch Open",
      "possible_causes": [
        "Sensor / actuator failure",
        "Wiring fault",
        "Module driver failure"
      ],
      "verified": false,
      "symptoms": [
        "MIL on",
        "Possible drivability impact"
      ],
      "repair_guidance": [
        "1) Read freeze-frame data and verify the fault is current.",
        "2) Inspect the affected sensor / actuator wiring for chafing, corrosion, or loose connectors.",
        "3) Measure circuit resistance + supply voltage with a multimeter.",
        "4) Compare live data against expected values per OEM service data.",
        "5) Replace the defective component if all wiring tests pass."
      ],
      "monitor_type": "continuous",
      "freeze_frame_relevant": true,
      "related_dids": [],
      "related_routines": [],
      "oem_bulletin": ""
    },
    {
      "code": "DI_a166",
      "severity": "critical",
      "description": "Drive Inverter Over-Temperature (Tesla DI)",
      "possible_causes": [
        "Sensor / actuator failure",
        "Wiring fault",
        "Module driver failure"
      ],
      "verified": false,
      "symptoms": [
        "MIL on",
        "Possible drivability impact"
      ],
      "repair_guidance": [
        "1) Read freeze-frame data and verify the fault is current.",
        "2) Inspect the affected sensor / actuator wiring for chafing, corrosion, or loose connectors.",
        "3) Measure circuit resistance + supply voltage with a multimeter.",
        "4) Compare live data against expected values per OEM service data.",
        "5) Replace the defective component if all wiring tests pass."
      ],
      "monitor_type": "continuous",
      "freeze_frame_relevant": true,
      "related_dids": [],
      "related_routines": [],
      "oem_bulletin": ""
    },
    {
      "code": "DI_w130",
      "severity": "warning",
      "description": "Tesla DI_w130 — Drive inverter over-temperature, power limited",
      "verified": false
    },
    {
      "code": "GTW_a005",
      "severity": "warning",
      "description": "Tesla GTW_a005 — Vehicle Gateway communication fault",
      "verified": false
    },
    {
      "code": "PARKBR_a001",
      "severity": "warning",
      "description": "Tesla PARKBR_a001 — Parking brake actuator fault",
      "verified": false
    },
    {
      "code": "UI_a013",
      "severity": "info",
      "description": "Sentry Mode: Storage Full",
      "possible_causes": [
        "Sensor / actuator failure",
        "Wiring fault",
        "Module driver failure"
      ],
      "verified": false,
      "symptoms": [
        "MIL on",
        "Possible drivability impact"
      ],
      "repair_guidance": [
        "1) Read freeze-frame data and verify the fault is current.",
        "2) Inspect the affected sensor / actuator wiring for chafing, corrosion, or loose connectors.",
        "3) Measure circuit resistance + supply voltage with a multimeter.",
        "4) Compare live data against expected values per OEM service data.",
        "5) Replace the defective component if all wiring tests pass."
      ],
      "monitor_type": "continuous",
      "freeze_frame_relevant": true,
      "related_dids": [],
      "related_routines": [],
      "oem_bulletin": ""
    },
    {
      "code": "VCFRONT_a172",
      "severity": "warning",
      "description": "Tesla VCFRONT_a172 — Charge port latch motor fault",
      "verified": false
    }
  ]
}
