{
  "$schema": "https://erdesigns.eu/schema/dtc-catalog.json",
  "version": 1,
  "name": "Great Wall Motor DTC starter",
  "default_source": "GWM (Haval / Wey / Tank / ORA / Poer) DTCs",
  "dtcs": [
    {
      "code": "B100F",
      "severity": "warning",
      "description": "GWM Coffee Pilot — front-camera obstructed",
      "verified": false
    },
    {
      "code": "P0299",
      "severity": "warning",
      "description": "Lemon DHT Turbo Underboost",
      "possible_causes": [
        "Sensor / actuator failure",
        "Wiring fault",
        "Module driver failure"
      ],
      "verified": false,
      "symptoms": [
        "MIL on",
        "Possible drivability impact"
      ],
      "repair_guidance": [
        "1) Confirm boost target vs actual via live data.",
        "2) Smoke-test the intake / charge-air system for leaks.",
        "3) Inspect wastegate solenoid and actuator rod travel.",
        "4) Check for cracked CAC, intercooler, or hose clamps.",
        "5) Replace failed solenoid / actuator if signal correct."
      ],
      "monitor_type": "continuous",
      "freeze_frame_relevant": true,
      "related_dids": [],
      "related_routines": [],
      "oem_bulletin": ""
    },
    {
      "code": "P0420",
      "severity": "warning",
      "description": "Catalyst System Efficiency Bank 1 (Haval / WEY)",
      "verified": false
    },
    {
      "code": "P0741",
      "severity": "warning",
      "description": "Torque Converter Clutch Performance (GWM 9HAT)",
      "verified": false
    },
    {
      "code": "P0A1F",
      "severity": "critical",
      "description": "Drive Motor Performance (Tank 700 / Wey Coffee)",
      "possible_causes": [
        "Sensor / actuator failure",
        "Wiring fault",
        "Module driver failure"
      ],
      "verified": false,
      "symptoms": [
        "MIL on",
        "Possible drivability impact"
      ],
      "repair_guidance": [
        "1) Read freeze-frame data and verify the fault is current.",
        "2) Inspect the affected sensor / actuator wiring for chafing, corrosion, or loose connectors.",
        "3) Measure circuit resistance + supply voltage with a multimeter.",
        "4) Compare live data against expected values per OEM service data.",
        "5) Replace the defective component if all wiring tests pass."
      ],
      "monitor_type": "continuous",
      "freeze_frame_relevant": true,
      "related_dids": [],
      "related_routines": [],
      "oem_bulletin": ""
    },
    {
      "code": "P0A80",
      "severity": "critical",
      "description": "Replace Hybrid Battery Pack (Hi4 / ORA)",
      "verified": false
    },
    {
      "code": "U0293",
      "severity": "critical",
      "description": "Lost Communication With BMS (ORA / Coffee EV)",
      "verified": false
    }
  ]
}
