{
  "$schema": "https://erdesigns.eu/schema/dtc-catalog.json",
  "version": 1,
  "name": "Renault / Dacia / Alpine DTC starter",
  "default_source": "Renault CLIP / Renolink / Pyren / Ddt4all DTCs",
  "dtcs": [
    {
      "code": "DF014",
      "severity": "warning",
      "description": "Throttle Body Adaptation Required (Renault MULTI-SENSE)",
      "possible_causes": [
        "Sensor / actuator failure",
        "Wiring fault",
        "Module driver failure"
      ],
      "verified": false,
      "symptoms": [
        "MIL on",
        "Possible drivability impact"
      ],
      "repair_guidance": [
        "1) Read freeze-frame data and verify the fault is current.",
        "2) Inspect the affected sensor / actuator wiring for chafing, corrosion, or loose connectors.",
        "3) Measure circuit resistance + supply voltage with a multimeter.",
        "4) Compare live data against expected values per OEM service data.",
        "5) Replace the defective component if all wiring tests pass."
      ],
      "monitor_type": "continuous",
      "freeze_frame_relevant": true,
      "related_dids": [],
      "related_routines": [
        "ecm_throttle_adapt"
      ],
      "oem_bulletin": ""
    },
    {
      "code": "DF026",
      "severity": "warning",
      "description": "Coolant Temperature Sensor: Range/Performance",
      "possible_causes": [
        "Sensor / actuator failure",
        "Wiring fault",
        "Module driver failure"
      ],
      "verified": false,
      "symptoms": [
        "MIL on",
        "Possible drivability impact"
      ],
      "repair_guidance": [
        "1) Read freeze-frame data and verify the fault is current.",
        "2) Inspect the affected sensor / actuator wiring for chafing, corrosion, or loose connectors.",
        "3) Measure circuit resistance + supply voltage with a multimeter.",
        "4) Compare live data against expected values per OEM service data.",
        "5) Replace the defective component if all wiring tests pass."
      ],
      "monitor_type": "continuous",
      "freeze_frame_relevant": true,
      "related_dids": [
        "ecm_coolant"
      ],
      "related_routines": [],
      "oem_bulletin": ""
    },
    {
      "code": "DF080",
      "severity": "warning",
      "description": "Renault — Coolant temperature sensor circuit (CLIP DF code)",
      "verified": false
    },
    {
      "code": "DF1058",
      "severity": "warning",
      "description": "4CONTROL Calibration Required",
      "possible_causes": [
        "Sensor / actuator failure",
        "Wiring fault",
        "Module driver failure"
      ],
      "verified": false,
      "symptoms": [
        "MIL on",
        "Possible drivability impact"
      ],
      "repair_guidance": [
        "1) Read freeze-frame data and verify the fault is current.",
        "2) Inspect the affected sensor / actuator wiring for chafing, corrosion, or loose connectors.",
        "3) Measure circuit resistance + supply voltage with a multimeter.",
        "4) Compare live data against expected values per OEM service data.",
        "5) Replace the defective component if all wiring tests pass."
      ],
      "monitor_type": "continuous",
      "freeze_frame_relevant": true,
      "related_dids": [],
      "related_routines": [],
      "oem_bulletin": ""
    },
    {
      "code": "DF112",
      "severity": "warning",
      "description": "Renault — UCH internal CAN H/W fault",
      "verified": false
    },
    {
      "code": "DF120",
      "severity": "info",
      "description": "Battery Saver Mode Active (Renault)",
      "possible_causes": [
        "Sensor / actuator failure",
        "Wiring fault",
        "Module driver failure"
      ],
      "verified": false,
      "symptoms": [
        "MIL on",
        "Possible drivability impact"
      ],
      "repair_guidance": [
        "1) Read freeze-frame data and verify the fault is current.",
        "2) Inspect the affected sensor / actuator wiring for chafing, corrosion, or loose connectors.",
        "3) Measure circuit resistance + supply voltage with a multimeter.",
        "4) Compare live data against expected values per OEM service data.",
        "5) Replace the defective component if all wiring tests pass."
      ],
      "monitor_type": "continuous",
      "freeze_frame_relevant": true,
      "related_dids": [],
      "related_routines": [],
      "oem_bulletin": ""
    },
    {
      "code": "P0299",
      "severity": "warning",
      "description": "Turbocharger Underboost (common Renault TCe)",
      "verified": false
    },
    {
      "code": "P11AB",
      "severity": "warning",
      "description": "DPF Differential Pressure Sensor — Range/Performance (Renault dCi)",
      "verified": false
    },
    {
      "code": "P1497",
      "severity": "warning",
      "description": "Renault EGR Position Sensor — Plausibility (1.5 dCi)",
      "verified": false
    },
    {
      "code": "P2509",
      "severity": "warning",
      "description": "ECM/PCM Power Input Signal Intermittent (Renault — alternator wear)",
      "verified": false
    },
    {
      "code": "U2102",
      "severity": "critical",
      "description": "Lost Communication With ABS Module (Renault CAN-H)",
      "verified": false
    }
  ]
}
